Query,Dialect,Query Real Answer
"घरना पोरं उघडा, नी याहीणले नेसाडा लुगडा.",Ahirani,घरातली पोर उघडी राहिली तरी चालतील पण व्याहिणीला साडी नेसवायची.
धल्ली मरो नि संगात करो,Ahirani,छोट्याशा गोष्टीसाठी मोठं मोठे प्रयत्न करणे
"जिना गळात गाठलं, तिलेच बसाले पाटलं",Ahirani,"गाठल म्हणजे गंठण, सोन्याचा मोठा गोफ.. पाटल= पाटल ,पिढ. श्रीमंत असामीचा आदर सत्कार होतो. सोने नाणे असलेल्यांनाच मान मिळतो, पैसेवाल्याचेच आदरातिथ्य होते."
तुला लगिन व्हायेल का?,Ahirani, तुझे लग्न झाले आहे का
मॅनेजर ना हापिस काठा शे?,Ahirani,मॅनेजरची केबिन कुठे आहे?
आखो कितला दूर जान शे?,Ahirani,अजून किती दूर जायचं आहे?
त्या मीटिंगले उशिरा कबर वनत?,Ahirani,त्या मीटिंगला उशिरा का येत आहे?
गावात तात्यावाचून पान हालानं नही. मानोस काही सिकेल व्हता आसे नही,Ahirani,गावात तात्याशिवाय पान हालत नाही. माणूस शिकलेला होता असं नाही.
पन कोनी काय टाप त्याले आंग्ठेबहादूर म्हनानी?,Ahirani,पण कोणाची हिंमत त्याला म्हणायची?
तात्याले वावरात जावानी कदी पाळी वनी नही,Ahirani,तात्यांना शेतात जायची कधीच पाळी आली नाही.
गावातला लोकंभी त्याले सळ खाऊ देवाना नही.,Ahirani,गावातील लोकसुद्धा त्याला शांत बसू देत नव्हते.
पंगतम्हानभी बसा मंडळी आसे म्हनालेभी तात्याज पायजे.,Ahirani,पंगतीत ‘बसा मंडळी’ असे म्हणणारा पण तात्याच हवा.
बोघोनं घेऊन ये.,Ahirani,पातेलं घेऊन ये.
संपुट देवळात ठेव.,Ahirani,फुलपात्र देवळात ठेव.
शिंगल आणून दे.,Ahirani,कप आणून दे.
लच्छ्या नवं घ्यायचं हाय.,Ahirani,पैंजण नवे घ्यायचे आहे.
डबडं स्वयंपाकघरात ठेव.,Ahirani,डब्बा स्वयंपाकघरात ठेव.
टोंगल स्वच्छ करून ठेव.,Ahirani,झुमके स्वच्छ करून ठेव.
नातासनी कदर भी पैसासना मायेक कारण दोन्हिसले कमावान कठिन शे गमावान सोप शे.,Ahirani,"नात्यांची कदर पैशासारखीच करा, कारण दोन्ही कमावणे कठीण आहे आणि गमावणे सोपे आहे."
हाड्या काव-काव करत होता,Ahirani,कावळा काव-काव करत होता.
"माय माय करू, माय साखरन पोतं",Ahirani,"आई, आई करू, आई साखरेच्या पोत्यासारखी गोड आहे."
"मायना बिगर, कोन करेना आलोखी ",Ahirani,आईशिवाय मला कोणीच विचारपूस करणार नाही किंवा माझी काळजी घेणार नाही.
मन मायमा मना गच्ची जीव शे,Ahirani,माझ माझ्या आईवर खूप प्रेम आहे
कसा होत राहणा मन बाळ न,Ahirani,कसा होताय माझा बाळा ला
वाह रे कपटी माणूस,Ahirani,वा रे कपटी माणूस—तू किती कपटी आहेस!
आळा पळ !,Ahirani, रात्री जागरण करू नकोस. चुपचाप झोप
अंध्यासना बजार भरना,Ahirani,अंधांना बाजार उभं राहा
दगडले शेंदूर लाईसन पुजतस,Ahirani,दगडले शेंदूर लावून पूजा करता
घरमा म्हातारा माय बापले,Ahirani,घरी म्हातारा आईवडील आहेत
अन्न पानीले उपाशी ठेवतस,Ahirani,अन्न आणि पाणी असूनही उपाशी राहता
सहजर ईचार दगडले,Ahirani,सहजपणे विचार करून दगड लावतो
रातोरात देव कसा झाया,Ahirani,रातोरात देव कसा झोपला?
सांगणा देवबा तुन रे गणित तंत्र,Ahirani,"सांग ना देवबापू, तू गणिताचं तंत्र सांगणार?"
डोकाना झितरा वाडाईसन,Ahirani,डोक्यावर झिटका घेतल्यास वाडे आणतात
भगत तालवर मुडंक हालवस,Ahirani,भक्त तालीवर मुद्रां हलवतो
देस मस्त उटलट्या थापा,Ahirani,देशात धमाल उलट्या ठोका पेटवतात
चौक वर भुक्या भुकमा तडपतस,Ahirani,चौकात भुकेले लोक तडपतात
डोयाना आंध्या दगडले अन्न खाऊ घालतस,Ahirani,"डोळ्याला अंधारासारखा दगड होतं,अंदपणी अन्न खातो"
घर लेकरे बाय उपाशी मरतस,Ahirani,घरातले लोक उपाशी मरत आहेत
कशी तुनी कमाल खोट दान तू करस,Ahirani,तू कसली कमाल खोटी दान करतेस!
जिवत पने वाईट वागणूक दिनी,Ahirani,जिवंत असतानाही वाईट वागणूक करता
मरावर अश्रू का गायस,Ahirani,मृत्यूवरही अश्रू नका गात नाही का?
भुक्या माय बापनी आगारीले,Ahirani,भुकेले आईवडीलाने आगारी सोडले
हाड्याले नैवद्य कशाले देखाडस,Ahirani,हाडांनी नैवध्य कोणाला दाखवले?
वाह रे कपटी पना तुना,Ahirani,"वा, तुझ्या कपटीपणाला तरी कसं स्थळ मिळालं?"
कसा बायकोना गुलाम व्हयना,Ahirani,बायकोला गुलाम करून ठेवू नकोस
माय बापनी दिना जनम तुले,Ahirani,आई-वडीलानी तुझे जन्म दिलं
म्हातारपने लाथा बुक्का मारत ऊना,Ahirani,म्हातारीपणात तुझ्यावर लाथी-पिटू मारत आहोत
नवरीनी फुई: वं बहिनीओन! आटपा! नवरी तय्यार व्हयनी का?,Ahirani,नवरीने: अहो बहिणींनो! नवरी तयार झाली का?
तिले जास्त टाईम लागस नट्टापट्टाले!,Ahirani,तिला जास्त वेळ लागतोय वरवरचे साज बांधायला!
ठावका बस,Ahirani,गपचूप राहणे
काम नैन धाम नै... नुसता नखराच दखा नटमोगरीना!,Ahirani,"काहीच काम नाही... फक्त नखर दाखवतेस, नटमोगरीना!"
का वं इजु? नवरदेवले ववाळाले ताट लिधं का?,Ahirani,का हे बाई? नवरा ने टाट गाळून दृष्टदान केला का?
त्या मां तुपना दिव्वा लावाले इसरु नकोस बर्का!,Ahirani,"त्या माला तेलात दिवा लावून रडू नकोस, बाई!"
तुले म्हाईत शे ना 'धल्ला' ना स्वभाव!,Ahirani,तुला माहित आहे ना 'धडला' म्हातारीचा स्वभाव?
जवाईले ववाळशी तव्हय डोक्यावर पदर घे जो!,Ahirani,जावळाने निखळून सोडलं म्हणून डोक्यावर पडर घे!
का वं बहीन्! माले म्हाईत शे ना!,Ahirani,अहो बहिणींनो! मला माहिती आहे ना!
हा वं बहीन्! जवाईले कळनं तं मग बसं व्हई गयं!,Ahirani,हो रे बहिणी! जावा समजल्या कि मग बसतं व्यवस्थित
आसा दांगडो घाली तो लगिनमां,Ahirani,असा तो दांडगडा घाली आणि तो लग्नात आहे
हाय शुभीना नवरा भलता आग्यायेताळ शे!,Ahirani,हे शुभिन! नवरा चांगला आग्यायेत आहे!
एक येळ इस्तव हातमां धरी जाई पन ह्यास्ना सोभाव ना ...,Ahirani,एक वेळ इस्तव हातात बसवली जातं पण त्याला सोभत नाही...
"बाप रे बाप! शुभे, तु आतेपुरती मन्ही नथ घाली ले बईन!",Ahirani,"हे बाप रे बाप! शुभे, तू येईपर्यंत मी नथही घालणार नाही!"
सासुरवाशीण कस्तुरा गावावरुन येउन पोचते,Ahirani,सासरवाशिण कस्तुरा गावून येऊन पोहोचली
"माय वं, अण्णाले पह्यलेच सांगं व्हतं मी ...",Ahirani,"माय बाई, अण्णाने आधीच सांगावं असं मला वाटतंय ..."
आम्हले निवतं धाडं व्हतं का? आन मंग जाते कसा बोलतस तुन्हा सासरकडना?,Ahirani,आमच्याकडे निवड पडते का? आणि तू सासरकडे कसं बोलतोस?
का वं कस्तुरा? माले एक सांग ... तुम्ही नणंदना देरना लगनमां ...,Ahirani,का काय कस्तुरा? मला एक सांग... तुम्ही नणंदला लग्नात...
आटपा आटपा... तठे नवरदेव ई लागना पारवर आनि तुम्ही काय चावळी राह्यनात आठे?,Ahirani,बघ बघ... तिथे नवरा विवाहावर आला आणि तुम्ही काय चावलं राहिलात का?
हाऊ बबन्या कोठे शिलगना? वर्णाडना स्वागत कराले फुलमाळा सांगन्या व्हत्या मी...,Ahirani,"हो बाबन्या, कुठे शिलगला? वर्णाडला स्वागत करण्यासाठी फुलमाळा सांगणं मी..."
"तो सत्या, आज्या तर काई कामनाच नै शे",Ahirani,"तो खरं सांगतोय, आज्या (आजकाल) काहीच काम नाही"
"त्या वाजावाला, पोटझोड्या उनात का? त्याले म्हना नेमबंद वाजवा ...",Ahirani,"त्या वाजवाला (वादकाला), पेट झोडलेल्या उन्हात का? त्याला म्हणा नेमके वाजव जसं..."
कव्वय जाई हाई 'सुख्या' आते पारवर?,Ahirani,कुठे जाई हा 'सुख्या' येणं पारवर?
बबन्या: हाई काय ई राह्यनु हार लीसन! घ्या वं बहिनीओन... गजरा बांधा!,Ahirani,"बबन्याने: हे काय राहिलं (थांबलं)?, घ्या बहिणींनो... गजरा बांधा!"
"दादा, मानकर्‍यास्नी लिश्ट व्हई ना?",Ahirani,"दादा, मानकरी सुटी पाळली का?"
पंगतीम्हानभी तास्ना ताटेसले लावाना शेतस!,Ahirani,पंगतिमधेही ताऱ्यांचा ताट लावायला शेतातस!
तेलनपापड्या लिध्यात का? आन सांजोर्‍या? त्या परमिलाले इचार बरं!,Ahirani,तेलात पापड टाकल्यानंतर का? आणि सांडोऱ्याइतका? त्यामाल्यावर...
तु बेळमाथनी पुजी राह्यन्थी तव्हय... कल्याण शे!,Ahirani,तू बळकटपणे उभं राहिलंत म्हणून कल्याण आहे!
गावा मधी आज झांज-पाथ लागली. ,Ahirani,गावात आज ढोल-ताशांचा कार्यक्रम झाला.
"जीवनमा साधापन, गर्व तर नही कया... ",Ahirani,जीवनात साधेपणा आहे; पण त्याचा काही गर्वच नाही...
"आला काळा हसत होतस, पण आतून मन ख्याली पडलं... ",Ahirani,"बाहेरून तो हसत होता, पण मन आतून खुप कुठ्याशा काहीतरी विचारात पडलेले होते..."
"वाटा काटेरी भलत्या, काटा पायले टोचेत... ",Ahirani,"वाट काटेरी होत असते, आपण चालू असतो, पण ती वाट टोचते, काट्याकडे नेत असते..."
संघर्ष नशिबी खरा... वाट मन्ही खडतर. ,Ahirani,संघर्ष हा नशीबातच खरा असतो... आणि वाट तर मनाच कठीण बनते.
"गणिमी कावा तुमना, नहीं कयन रे माले... ",Ahirani,"गणाची गोष्ट म्हणतोय तुम्हाला, नाही म्हणून का सांगू मी..."
गावात तात्यावाचून पान हालानं नहीं.,Ahirani,गावात तात्या (वडिल) याशिवाय पान (परंपरा) हलत नाहीत.
तात्याला साळ खाऊ देवाणा नहीं. ,Ahirani,तात्याला साळ (आदर) करणं द्यायला ग्रामस्थ तयार नाहीत.
सग्ळी जागावर तात्या हजर र्हायना... ,Ahirani,प्रत्येक ठिकाणी तात्या उपस्थित राहणार असं काही नाही...
याळम्हान कवळज तोंडवरथून पाणी फिरावाना नहीं... ,Ahirani,पाण्याचे थेंब किंवा स्त्रोत तोंडावरून फिरवून दाखवलं जातं नाही... (मानसिक मिठास दाखवायला)
टोपील टार्च दिलेल र्हावानी. ,Ahirani,(तात्याला) टोपी व टॉर्च देऊन दाखवून मान दिला जातो.
आठोदाभर तात्या त्याज कपडे वापराना... पण कधी मलेल दखावाना नहींत. ,Ahirani,दीर्घ काळ तात्याचा वापर होणारा कपडा वापरला जातो; पण तो कधीच घाणलेला दाखवायला नाही.
पंगतिम्हानभी बसा मंडळी असे म्हणालेभी तात्याज पायजेच. ,Ahirani,"पंगतीत बसायला सांगितलं तरीही, तात्याचा आदर म्हणून त्यांचं स्थान राखलं जातं."
"न्यारा चेहरा जगना, माले ये नी ते शिकाड...",Ahirani,"वेगळा चेहरा जगाला दिसतो, पण माझ्यासमोर तो काही वेगळ्या छटा दाखवत नाही..."
"तारी काटेरी वाटा... हिम्मतथीन चालनू, बठा गंमत देखेत...",Ahirani,"ती वाट खूप कठीण आहे, पण हिम्मत न सोडता हसत चालत जा..."
"जग जस दिसस हो, तस ते नहींच र्हास...",Ahirani,"जग जसा दिसतो, तसा तो खरा नसतो..."
"संघर्ष नशिबी खरा, वाट मन्ही खडतर...",Ahirani,"संघर्ष हा नशिबात ठरलेला असतो, पण ती वाट मनाला फार कठीण वाटते..."
माले ये नी ते शिकाड...,Ahirani,"माझ्यासाठी जे काही आहे, ते त्याचं रूप किंवा छटा आहे..."
हाय पाईसन तिनं डोकं फिरनं...,Ahirani,अशी भीती वाटते की तिचं डोकं फिरतंय...
गुपचूप जाईसन भाजीना पातीलामा परातभर मीठ टाकी दिधं...,Ahirani,गुपचूप भाजीमध्ये/सारणात भरपूर मीठ टाकलं...
अवदसाना डोळा उघडनात... ती समोर ईसन लक्ष्मीना पाय पडनी...,Ahirani,अवदसाने डोळे उघडले आणि समोर लक्ष्मीच्या पायावर पाय ठेवला...
सग्ळी जागावर तात्या हजर र्हायना...,Ahirani,प्रत्येक ठिकाणी तात्याची उपस्थिती असणे शक्य नाही...
तात्याने वापरलेले कपडे कधीच मळलेले दाखवत नाहीत…,Ahirani,तात्यांचे वापरलेले कपडे कधीही घाण दिसत नाहीत...
गह्यरां फिरी फिरी येस,Ahirani,गहू (पिक) फिरत-फिरत येते. / गव्हाचे पेरणे-वाटप चालू आहे.
पहिरेल उगत ऱ्हास,Ahirani,पहाटे उठले की सकाळ उजळते. / सकाळ होते तेव्हा प्रकाश उगवतो.
बैल व्हयी गाड व्हडी ऱ्हायंता,Ahirani,बैल गाडीच्या बळावर काम करत आहेत. / बैलांनी गाडी ओढत काम चालू ठेवले.
कर्ज डोकावर बठी हासत ऱ्हास,Ahirani,कर्ज डोक्यावर असूनही (लोक) हसत आहेत — दुःखापासून तेगुप्तपणे वागत आहेत.
आत्ये पाऊस येना रे,Ahirani,अरे ये पाऊस येतो आहे! / पाऊस सुरू होतोय.
उकाड्या उन्हातून घरचे ओले जावं,Ahirani,उकाड्याच्या उन्हात घरातील कामं करताना सगळे पसीने पिळू लागतात.
"रात्रीचं गाव शांत, पंथ ठाणात",Ahirani,गाव रात्री शांत असतं; मार्गावर वस्तू ठामपणे उभ्या असतात.
दुपारी जेवणानं पहिले खाऊन मी थोडी विश्रांती घेतली,Ahirani,दुपारी जेवण करून मी थोडी विश्रांती घेतली.
पाणी न मिळाल्यावर पिकं उपटतात,Ahirani,पाण्याशिवाय शेतीची पिकं सुकायला लागतात.
पांढऱ्या धुक्यात गावी सारा थरार,Ahirani,पांढऱ्या धुक्यात गावात सगळे दृश्य वेगळे दिसते.
आंबान्ह झाडाची फांद्या एकमेकांत गुंतल्या,Ahirani,आंब्याच्या झाडांच्या फांद्या एकमेकांत गुंतल्या आहेत.
"तुमीन जरा ध्यानखाल दखा, आपला आजूबाजूले दखावन्हारा झाडे झुडे, जीव जंतु ह्यासुद्दा पर्यावरनना संगे तायमेय ठेवासाठे सोतानं रुप आसो गंध आसो यान्हा मार्फत व्यक्त व्हत र्हातंस",Ahirani,"तुम्ही थोडं लक्ष द्या; आपल्या आजूबाजूच्या झाडं, झुडुपं, जीव-जंतु हि पर्यावरण सांभाळण्यासाठी आपल्या रूप, वास यांमधून व्यक्त होत राहतात"
"जगम्हातली कुठलीबी भाश्या जर सिकानी व्हुई ते, वर सांगेल परमानेज आपले वागनं पडी",Ahirani,"जगात कोणतीही भाषा आपण शिकली तरी, आपल्या वागण्यावर त्या भाषेचा परिणाम सूरतो"
"आपेन आपला रोजाना व्यवहारम्हा यान्हा वापर कर्तसच, पन याले नेमकं काय म्हन्तस हाईज आपुनले ध्यानम्हा नई र्हास",Ahirani,"आपण आपला रोजचा व्यवहार येथे वापर करतो, पण हे नेमके काय म्हणतात हे आपल्याला अजिबात लक्षात येत नाही"
