Query,Dialect,Query Real Answer
आपून वर सांगेल परमाने वागतस का? हाई जरा सोतालेज ईच्यारी दखा! आपन तसा वागतसच नथीन,Ahirani,स्वतःला सांगेल की तुम्ही का तसे वागताय? हे थोडं सोप्या पद्धतीने पहा! आपण तसा वागत नसतो
"तुमीन जरा ध्यानखाल दखा, आपला आजूबाजूले दखावन्हारा झाडे झुडे ...",Ahirani,"तुम्ही थोडं लक्ष द्या; आपले आजूबाजूचे झाडं-झुडुपं, जीव-जंतु पर्यावरणासाठी रूप आणि वास यांमधून व्यक्त होत आहेत"
आपन रोज सकाय झोपम्हाईन उठीसन पुनाईन जपत लगून जितालाबी कामे चोवीस कलाकम्हा कर्तस,Ahirani,"आपण रोज सकाळ झोपण्या आधी उठतो आणि नंतर काम करत, दिवसभर तीन चौवीस तास विविध कामे करतो"
तुमले दखावथीनज दखावथीन मोबाईलवर जर शंभर खटला व्हतीन ते त्याम्हा सत्तर ते ऐन्सी टक्का खटलासवर आसा हावस्या,Ahirani,"तुमच्या मोबाइलवर जर शंभर चॅट्स झाले असतील, त्यात सत्तर ते ऐंशी टक्के चॅट्स तुमच्यासाठी हवस्ये/आवडीचे असतात"
"मन्हा वाचनम्हा, आयकाम्हा जितलाबी अहिरानी पटलासव्हरना लिखन्हारा बोलन्हारा शेतंस त्याम्हा सामाजिक, शैक्षनिक, सांस्कृतिक, भौतिक आसा सर्वगूनसंपन्न ज्या विचारवंत, लेखक...दखावनात",Ahirani,"माझ्या वाचनात/अनुभवात, जेव्हा अहिराणी पटलावर येतात, लिखित आणि बोलणाऱ्या लोकांना सामाजिक, शैक्षणिक, सांस्कृतिक आणि भौतिक दृष्ट्या सर्व पैलूंचे विचारवंत/लेखक दिसतात"
आता आपन आखो एक वज्जी भारी मुद्दाना ईच्यार करूत. ह्या मुद्दानं नाव जरी धाकलसंच से तरी त्याम्हा भू भारी मतितार्थ भरेल से,Ahirani,आता आपण एक मोठा महत्वाचा मुद्दा उचलतोय. त्या मुद्द्याचा नाम धाकटी असला तरी त्याचा विचार महत्त्वाचा होईल
"तुम्हीन जरा ध्यानखाल दखा! आपन तसा वागतसच नथीन. बरं वागतस नैत ते नैत, त्याउप्पर आगाऊपना करीसनी बोलतस",Ahirani,तुम्ही थोडं लक्ष द्या! आपण तसे वागत नाही. ठीक आहे वागतसे पण त्या व्यवहारावर आधी विचार करून बोलता
अडस,konkani,छान
सरबरीत,konkani,वेडा
शाप व्हल्पटून टाकेल.,konkani,"
मारेन"
नकावडी,konkani,थोडी 
वसाड्या,konkani,पणवती
लाक्या,konkani,"
खोटारडा"
मुस्काट,konkani,चेहरा
माका / तुका,konkani,मला / तुला
खय ,konkani,कुठे 
झाटलिमन,konkani,"
रुबाबदार"
खबरांक म्हाका विसरुंक नका,konkani,मला बातमी देताना विसरू नकोस.
देवाक लागीं म्हाका संभाळ करता.,konkani,देव नेहमी माझी काळजी घेतो.
रेंदेर माडाशेर चडटात.,konkani,माकडे झाडावर चढतात.
कितें म्हाका जाय म्हून्न सांग.,konkani,मला काय हवे आहे ते सांग.
तुका सांगुंक जाल्यार खुब खुशी.,konkani,तुला सांगितल्यावर मला खूप आनंद होतो.
म्हाजे भितरले भाव गोप्या आसतात,konkani,माझ्या आतल्या भावना गुप्त असतात
हांव जाल्यार म्हाजो देश सेवा करता.,konkani,मी झालो तर माझ्या देशाची सेवा करीन.
ते लोक एकवट्टींत उत्तर दीउंक लागलें,konkani,त्या लोकांनी एकत्र येऊन उत्तर दिले
पावसाचीं धुं घोड्डे घेवून येतात.,konkani,पावसासोबत धुके डोंगरावर येते
म्हाका खुशी म्हून्न तुजें उत्तर आइलो,konkani,मला आनंद झाला की तुझे उत्तर आले
हांव म्हाका सांगुंक विसरलो.,konkani,मी सांगायचे विसरलो.
आमकां तुका मेळपाक खुब आसा आसात.,konkani,आम्हाला तुला भेटायची खूप इच्छा आहे.
तो रात्रीचेर आवाज म्हाका भितर जालें.,konkani,रात्रीचा आवाज मला आतून जाणवला.
तुमकां एकवट्टींत काम करुंक जाय.,konkani,तुम्हाला एकजुटीने काम करायचे आहे.
म्हाका काळजाचें खबर कोस्ली मेळ्ली,konkani,मला मनाची एक बातमी मिळाली.
भुर्गें पोदवी घेवुंक आसात,konkani,मुले पदवी घेत आहेत
ते लोक घराचेर भितर बसले आसात.,konkani,ते लोक घरात बसले आहेत.
रात्री सगळे तारे निस्तात,konkani,रात्री सर्व तारे चमकतात.
म्हाका परिक्षेत खुब भीरांत वाटलें.,konkani,मला परीक्षेत खूप भीती वाटली
आमकां पावसाचें खुशी जालें.,konkani,आम्हाला पावसामुळे आनंद झाला.
हांव तुमकां खबर दीउंक विसरलो.,konkani,मी तुम्हाला बातमी द्यायची विसरलो
हांव म्हाका काईं विसरुनास.,konkani,मी काहीही विसरलो नाही.
तुमकां घराचें काम संभाळुंक जाय.,konkani,तुम्हाला घरकाम सांभाळावे लागेल.
ते लोक बाजारांत खोंब घालता.,konkani,ते लोक बाजारात गर्दी करतात
भुर्गें स्कूलांत वाट घेता.,konkani,मुले शाळेत रांगेत उभी राहतात.
रेंडे म्हाका थोड्डें वाटलें.,konkani,मला खोरं थोडं लहान वाटलं.
आमकां एकवट्टींत जीवंत रावपाक जाय.,konkani,आम्हाला एकतेने जगायला हवे.
म्हाका भितर सगळे खुशी आसतात.,konkani,माझ्या मनात खूप आनंद आहे.
तुमकां काळजाचें गोप्या विसरुंक नका.,konkani,तुम्ही मनातील गुप्त गोष्टी विसरू नका.
आमकां सगळेआ खबर मेळ्ली.,konkani,आम्हाला सर्व बातम्या मिळाल्या.
तो म्हाका एकवट्टींत मोग करता.,konkani,तो मला मनापासून प्रेम करतो.
भुर्गें रात्रीचेर काळजांत उबोर्लें.,konkani,मुले रात्री मनाने जागी राहिली
म्हाका घोड्ड्यांक भितर भीरांत आसा.,konkani,मला घोड्यांपासून भीती वाटते.
आमकां पावसाचेर फुद्दर जालें.,konkani,आम्ही पावसामुळे पुढे गेलो.
उगड्डस म्हाका बरोबर आइलं.,konkani,आठवण मला योग्य वेळी आली.
जोडडोप घेऊनक तो उत्तर मेळ्लो,konkani,बेरीज करून त्याला उत्तर मिळाले.
अक्कोरशोन म्हाका भितोर जालं.,konkani,आकर्षण माझ्या मनात निर्माण झाले
कांतल्लो म्हाका परिक्षेत जालो.,konkani,परीक्षेत मला कंटाळा आला.
ओन्नुभोव म्हाका जीवाचें दाखोवलें.,konkani,अनुभवाने मला जीवन दाखवले.
इबड्ड म्हाका घर सरकेम जालो.,konkani,घरासारखे नुकसान झाले.
स्फोट्ट म्हाका भितर आवाज आइलं.,konkani,आतून स्फोटासारखा आवाज आला.
वोइजकी उपकार म्हाका खुब जालें,konkani,वैद्यकीय मदत मला खूप झाली.
तो धोंपर दुखलो आनी तो पिडेस्त जालो.,konkani,त्याला गुडघा दुखला आणि तो आजारी पडला.
म्हाका म्होंवामूस पोळ्ळेंव भय दिसलो.,konkani,मला मधमाशी पाहून भीती वाटली
ताच्यान घळ सोधुंक जाउंक नां.,konkani,त्याला दरीतला रस्ता शोधता आला नाही.
ताचो धिकार उगटो जालो.,konkani,त्याचा अधिकार उघड झाला.
ह्या मुद्रपिंडा भायर वचत ना.,konkani,ही मूत्रपिंड बाहेर जाणार नाही.
ताच्यान झेल काड्डुंक जाले ना.,konkani,त्याला बर्फ काढता आले नाही.
ताच्या घरा लागीं एक घळ आसा.,konkani,त्याच्या घरा जवळ एक दरी आहे.
ह्याचें पुस्तकाचो अपकार नासलो.,konkani,या पुस्तकाचे उपकार नव्हते.
तांचें अवकाशान आमचें सोयम्बाचो बदल जालोय.,konkani,त्यांच्या रिकाम्या वेळेमुळे आमच्या स्वभावात बदल झाला.
तें घोड वारें आसलें.,konkani,ती घोड्यासारखी हवा होती.
म्हजी बाय कडयेन विणली.,konkani,माझी पत्नी कापसाने विणली.
रात्रीचेर अस्तंत दिश्ठी पडलो.,konkani, रात्री पश्चिम दिसली.
तुं कितें कारणान मुखदार जाता?,konkani,तू कोणत्या कारणामुळे समोर येतो?
ताचें भुरगेंपण खुब आनंदी आसलें,konkani,त्याचे बालपण खूप आनंदी होते.
तो एक धिकार मनीस आसलो.,konkani,तो एक अधिकार असलेला माणूस होता.
आमकां बुद्द नासलो.,konkani,आम्हाला बुद्धी नव्हती.
घरा लागीं एक झेल आसा.,konkani,घरा जवळ एक बर्फाचा तुकडा आहे.
एक कोंस दिसलें.,konkani,एक कणीस दिसले.
पिशारपणान तो पिशो जालो.,konkani,वेडेपणामुळे तो वेडा झाला.
तो निदोर जालोय.,konkani,तो झोपलेला आहे.
तो पिडेस्त जालो.,konkani,तो आजारी झाला.
ते आवल पडले.,konkani,ते दगड पडले.
ताच्यान आखाणो काड्डुंक जाले ना.,konkani,त्याला अंगठा काढता आला नाही.
एक मूर्त देवुलाचो दाखायलो.,konkani,एक मूर्ती देवांची दाखवली.
ताचो धाको ताडलो.,konkani,त्याचा धागा तुटला.
धोर्ण्ण पाळुंक आमकां फर्ज आसा,konkani,नियम पाळणे आपला कर्तव्य आहे.
आमकां मोग आसलो,konkani,आम्हाला प्रेम होते.
सुर्यो उदेंत उडतो.,konkani,सूर्य सकाळी पूर्वेकडून उगवतो
बोडवोन्नी मेळ्लुंक लोकांक सहाय जातां.,konkani,सूचना मिळाल्यावर लोकांना मदत होते.
धोर्ण्ण पाळुंक आमकां फर्ज आसा.,konkani,नियम पाळणे आपला कर्तव्य आहे.
शिकोप मेळ्लुंक चेड्डां भितोर घालता.,konkani,शिक्षा मिळाल्यावर मुले घाबरतात.
शिकॉण्ण म्हाका जीवाचें मार्ग दाखोवलं.,konkani,शिक्षणाने मला जीवनाचा मार्ग दाखवला
उत्प्रोख दिऊंक लोकांक कल्पना जाता.,konkani,उपमा दिल्याने लोकांना कल्पना येते.
आयजकाल म्हाका काम करुंक सकोईलं.,konkani,आजकाल मला काम करणे शक्य झाले.
पोरमोल्ल म्हून्न घरांत शोभित जालो.,konkani,महत्त्वामुळे घरात शोभा निर्माण झाली.
रुन्न घेताम घरांत दुःख जालो.,konkani,कर्ज घेतल्याने घरात दुःख आले.
शक्ती आसा म्हून्न तो जीव करून पावला.,konkani,ताकद असल्याने तो यशस्वी झाला.
काळजोप करुंक म्हून्न आमी घेवचें,konkani,काळजी घेणे म्हणून आम्ही घेतले.
हकीक म्हाका सांगपाक खुब अवघड जालें.,konkani,सत्य सांगणे मला खूप अवघड झाले.
गुस्पोन्नेचें उत्तर म्हाका काळजाचें जालें.,konkani,गुंतागुंतीचे उत्तर मला मनात आले.
लोवचिक वस्त्र म्हाका शोभित दिसता.,konkani,लवचिक वस्त्र मला सुंदर दिसते.
उद्धार म्हाका गुरूचें काळजाचें मेळ्लें.,konkani,उद्धार मला गुरूच्या कृपेने मिळाला.
धरनी म्हाका भितोरांत दिसता.,konkani,पृथ्वी मला आतून (मनातून) दिसते.
धाडप म्हाका बरोबर मेळ्लें,konkani,पाठवलेली वस्तू मला योग्य मिळाली.
पालव म्हाका नवी जालें.,konkani,पालवी मला नवीन दिसली.
नियाळप म्हाका चिंतोप जालें.,konkani,निरीक्षण मला विचारात टाकले.
लटिकु म्हाका बाजारांत मेळ्लो,konkani,फळी मला बाजारात मिळाली.
उच्छाउ म्हाका मंदिरांत मेळ्लें.,konkani,उत्सव मला मंदिरात मिळाला.
त्येचं गपरी कोण मानुस धांवणार. करनोनारा नवता.,Varhadi,"
त्याच्या घरी काम करणारा कोणीच पुरूष नाही."
तेल्या दिसला कुतरा घेआसारका,Varhadi,त्याला एक कुत्रा दिसतो जो तो आणू शकतो.
त्याला अखिन याद याद आली तेन पन्नास रूपे घेतले,Varhadi,त्याला पुन्हा एकदा आठवलं की त्याला ५० रुपये घ्यावे लागतील.
त्या पोऱालो नव्हाल वाटलो,Varhadi,त्या मुलाला आश्चर्य वाटलं
घेतला ताथी नेऊन सोडला,Varhadi,तो तिथून निघून गेला जिथून त्याने उचलले होते.
नवरिका बाप फिकिरित,Varhadi,नवरीचा बाप चिंतेत आहे
मैने दोन मैने रयली,Varhadi,ती तिथे २ महिने राहिली
यानं केला त्या पता कडाला पायजे ,Varhadi,त्याने त्याचा पत्ता शोधावा
मंग देनाच पडला त्याले,Varhadi,मग त्याला द्यावंच लागलं
कंट्या वोक्ती लग्न कराता,Varhadi,कोणत्या वेळी लग्न करता
"एका कवडिले बाईल इकला, पाचे रुपयचा",Varhadi,त्याने आपला बैल पाचशे रुपयांना विकला
जो तुमचा बुधा आहे घंरी तो सानल,Varhadi,घरी एक म्हातारा माणूस आहे तो तुम्हाला सांगेल
दुसरा हांडा कुठे हय,Varhadi,दुसरा हांडा कुठे आहे
लग्न झाला ता तो निंगाला,Varhadi,लग्नानंतर तो निघून जाऊ लागला
धावत पायत ते भाकर बांदली,Varhadi,धावत-पळत त्याने भाकरी बांधली
का वं मा बैनीले न बाप्पूले जेवाले बलावाचा ईचार हाये,Varhadi,मी बहिणीला आणि बाप्पाला जेवायला बोलावण्याचा विचार करत आहे
बलावाना बाप्पा मी का तुमाले नाई मंतो कां कंधी,Varhadi,त्यांना यायला सांगा मी कधी तुम्हाला नाही म्हटलं का?
ता संग बोलनं म्हंजे ना पंचे लयच भारी काम हाये,Varhadi,"त्यांच्याशी बोलणं म्हणजे ना, खूप अवघड काम आहे"
नाई ना थे त कालच गेली,Varhadi,"नाही, ती कालच गेली "
"मी जाईन आठंक दिवसानं, तेवळाच जीवाले अराम",Varhadi,"मी आठ दिवसांनी जाईन, मला आराम मिळेल"
"हवं, च्या पेल्यावर कायचा थांबते थो",Varhadi,चहा पिल्यानंतर तो का थांबेल?
मले काय तुमी म्याट समजता काय,Varhadi,तुला वाटतंय मी वेडा आहे का?
आता हे दोन्ही पोट्टे कुटं गेले,Varhadi,आता ही दोन्ही मुलं कुठे गेली?
कचरा घिवून गेले टाकाले त अजून आलेच नाई,Varhadi,"कचरा घेऊन गेले टाकायला, पण अजून आलेच नाहीत"
जा बरं पावून या तुमी तेयले,Varhadi,जा आणि ते कुठे आहेत ते बघ
तुमचे पोरंयी काय कमी हाये काय,Varhadi,तुमची मुलगीही चांगली आहे.
लोकं कुटयी फेके कचरा,Varhadi,लोक कुठेही कचरा टाकतात
बिमाऱ्या त लयच कमी हुन रायल्या,Varhadi,आजार खूपच कमी झाले आहेत
आता तू मंत त खरंच असंन,Varhadi,जर तुम्ही असे म्हणत असाल तर ते खरे असले पाहिजे
कच ईशय धा खेपा काळता,Varhadi,तू एकच गोष्ट १० वेळा पुन्हा सांगत आहेस
तुयी माय तं साळी नेसते,Varhadi,तुझी आई साडी घालते
मी गेम खेवून रायली मोबाईलवर,Varhadi,मी मोबाईलवर गेम खेळत आहे
भजे खा चे असंन त घिवून या,Varhadi,जर तुम्हाला भजी खायची असेल तर जा आणि घेऊन ये
आता येवळ्या लौकर उठून काय करु मी,Varhadi,"माझा हात दुखत आहे, कणिक मळल्यामुळे"
रखमे मांड बर च्या बाबासाठी,Varhadi,"रखमा, बाबांसाठी चहा ठेव"
धुतलं ना वं माय म्या तोंड मंघानीच,Varhadi,"धुतलं ना गं आई, मी तोंड मगाशीच"
म्याही मनलं मंग सासुरवाळीले जाआच हाये त बा चांगलं दनक्यात जावू,Varhadi,या वर्षीपासून धरणाचे पाणी मिळत असल्यामुळे गावातील सर्वच शेतकरी दोन-तीन पिके घेण्याच्या प्रयत्नात आहेत
आता मातरं बबनले सोंगाची कायजी मिटल्यावानी वाटली,Varhadi,आता मात्र बबनला सोंगाची काळजीपासून सुटका मिळाल्यासारखं वाटलं
