Query,Dialect,Query Real Answer
"उद्या भंडारा आहे, मी तिकडे जेवण करेल",Satara,उद्या गावात एक मोठा जेवणाचा कार्यक्रम आहे आणि मी तिथे जेवण करेन.
आज आमच्या मेंढीला कोकरू झालं,Satara,आज आमच्या मेंढीने एका पिल्लाला जन्म दिला
राणी मेंढी ला बकरा झाला,Satara,राणी नावाच्या मेंढीला बकरं झालं.
"रडा होणार , पोरं नाय ऐकणार",Satara,"रडा' या शब्दाचा अर्थ गोंधळ,किंवा भांडण असा होतो.मुले तुमचे ऐकणार नाहीत आणि त्यामुळे खूप गडबड किंवा गोंधळ होईल"
अजित पवारांनी 13 कोटींचा घोळ केला,Satara,अजित पवार यांनी 13 कोटी रुपयांचा घोटाळा किंवा गैरव्यवहार केला आहे
सगळे नेते भ्रष्टाचारी आहेत,Satara,सर्व राजकीय नेते भ्रष्टाचार करतात.
पाणी पाजून आण,Satara,पाणी पिऊन ये
रणातलं पाणी पेटलय,Satara,शेतातील पाणी कमी झाले आहे
भाकरीला भाजून दे,Satara,भाकरीला नीट भाजून दे
तो लयच कामात गुंतलाय,Satara,तो खूप जास्त कामात व्यस्त आहे
आजचा दिवस उकाडा आहे,Satara,आजचा दिवस खूप उष्ण आहे
आमच्या शेतात गहू पेरलेत,Satara,आमच्या शेतात गहू पेरले आहेत
त्याला बघावाच लागेल,Satara,त्याला बघावेच लागेल
जांभळाचा पाऊस पडतोय,Satara,जांभळ्या रंगाचा पाऊस पडत आहे
जनावरांना चारा दे,Satara,जनावरांना खायला दे
मी लवकरच गावात येईन,Satara,मी लवकरच गावी येईन
गाडीला रंग मारायचा य,Satara,गाडीला रंग लावायचा आहे
हा माणूस माझ्या ओळखीचा नाय,Satara,हा माणूस माझ्या ओळखीचा नाही
आज बाजारपेठेत गर्दी हाय ,Satara,आज बाजारपेठेत गर्दी आहे
ती खूपच चतुर हाय ,Satara,ती खूपच हुशार आहे
आम्ही बाहेर फिरायला गेलो होतो,Satara,आम्ही बाहेर फिरायला गेलो होतो
आज पाऊस पडल का?,Satara,आज पाऊस पडेल का?
त्याचा स्वभाव चांगला हाय,Satara,त्याचा स्वभाव चांगला आहे
मला एका मित्राची मदत हवीय,Satara,मला एका मित्राची मदत हवी आहे
तो माझा जुना मित्र हाय,Satara,तो माझा जुना मित्र आहे
मी तुला नंतर कॉल करन,Satara,मी तुला नंतर फोन करेल
आज खूप थंडी हाय ,Satara,आज खूप थंडी आहे
तो नेहमीच हसतो,Satara,तो नेहमीच हसत असतो
त्याला भूक लागली य,Satara,त्याला भूक लागली आहे
आम्ही एकत्र जेवतो,Satara,आम्ही एकत्र जेवण करतो
हा रस्ता कुठे जातो?,Satara,हा रस्ता कुठे जातो?
मी आज शाळेत गेलो नाय,Satara,मी आज शाळेत गेलो नाही
ती खूप छान गाते,Satara,ती खूप छान गाते
मला एक नवीन ड्रेस हवाय ,Satara,मला एक नवीन ड्रेस हवा आहे
तो चांगला खेळाडू आहे,Satara,तो एक चांगला खेळाडू आहे
आजचा दिवस खूप व्यस्त होता,Satara,आजचा दिवस खूप व्यस्त होता
ती रोज व्यायाम करते,Satara,ती रोज व्यायाम करते
मला लवकर झोपायचे हाय ,Satara,मला लवकर झोपायचे आहे
तो कामावर गेलाय,Satara,तो कामावर गेला आहे
मी नवीन घर घेतल य ,Satara,मी नवीन घर घेतले आहे
आजची हवा खूप चांगली हाय,Satara,आज हवा खूप चांगली आहे
त्यांना नवीन नोकरी मिळाली या,Satara,त्यांना नवीन नोकरी मिळाली आहे
